{
  "schema_version": "systemone/1",
  "id": "feature-perception",
  "version": "1",
  "purpose": "feature-perception",
  "questions": {
    "F1": {"question": {"type": "choice", "instructions": "What is the plausible cadence of the named capability based only on its text description?", "criteria": {"intraday": "Normally occurs more than once per day", "daily": "Normally occurs about daily", "weekly": "Normally occurs about weekly", "monthly": "Normally occurs about monthly", "quarterly": "Normally occurs about quarterly", "annual-or-rarer": "Normally occurs annually or less often", "irregular": "No regular cadence is implied"}}, "authority": "veto", "trigger": ["quarterly", "annual-or-rarer", "irregular"], "consumer": "rules.raise_only", "gold": "system-of-record cadence"},
    "F2": {"question": {"type": "noul", "instructions": "Does the capability description indicate a regulated, statutory, contractual, or audit obligation?"}, "authority": "veto", "consumer": "rules.raise_only", "gold": "dual-adjudicated legal review"},
    "F3": {"question": {"type": "noul", "instructions": "Does the text indicate that an external system reads from or writes to this capability?"}, "authority": "veto", "consumer": "rules.raise_only", "gold": "system-of-record integration logs"},
    "F4": {"question": {"type": "noul", "instructions": "Does the human-authored text describe a workaround for this capability?"}, "authority": "flag", "consumer": "review.queue", "gold": "dual-adjudicated"},
    "F5": {"question": {"type": "choice", "instructions": "Which business process best matches this capability?", "criteria": {"customer-service": "Serving or supporting customers", "finance-close": "Accounting, reconciliation, or period close", "sales": "Lead, opportunity, or order work", "operations": "Internal operational execution", "compliance": "Legal, regulatory, or audit work", "other": "None of the named processes clearly fits"}}, "authority": "suggest", "consumer": "review.prefill", "gold": "analyst"},
    "F6": {"question": {"type": "choice", "instructions": "If deterministic rules establish that this capability is never used, what text-described reason best fits?", "criteria": {"never-needed": "No demonstrated need", "too-complex": "Users avoid it because it is too difficult", "duplicate": "Another capability performs the same job", "wrong-fit": "It does not fit the actual process", "unknown": "The text does not establish a reason"}}, "authority": "suggest", "consumer": "review.prefill", "gold": "analyst"},
    "F7": {"question": {"type": "choice", "instructions": "How difficult does the text-described capability appear to replace?", "criteria": {"trivial": "A small deterministic transform or prompt", "moderate": "A bounded workflow with limited state", "hard": "Shared state, permissions, integrations, or transactional behavior"}}, "authority": "flag", "trigger": ["hard"], "consumer": "risk.register", "gold": "validated-design"},
    "F8": {"question": {"type": "noul", "instructions": "Does the visible label appear to identify a deprecated, temporary, test, sandbox, or demo capability?"}, "authority": "prioritize", "consumer": "review.queue", "gold": "observed-ui"}
  }
}
